{
  "metadata": {
    "case_id": "pyelonephritis-intermediate",
    "title": "Fever, loin pain and burning urine in a 34-year-old woman",
    "difficulty": "Intermediate",
    "specialty": "Internal Medicine",
    "estimated_time": 25,
    "author": "seed",
    "schema_version": 1,
    "reviewed_by": "Dr. A. Reviewer",
    "reviewer_credentials": "MBBS, FCPS (Medicine)",
    "reviewed_at": "2026-06-21",
    "medical_signoff": true
  },
  "patient": {
    "name": "Chloe Bennett",
    "age": 34,
    "gender": "female",
    "occupation": "Nurse",
    "ethnicity": "White British",
    "personality": "Unwell, feverish",
    "communication_style": "Cooperative, shivery"
  },
  "history": {
    "chief_complaint": "High fever with right-sided back pain and painful urination",
    "history_of_presenting_illness": {
      "onset": "Two days of dysuria, now fever and loin pain",
      "urinary": "Burning on urination, frequency and urgency",
      "loin_pain": "Right loin pain radiating to the groin",
      "systemic": "Rigors, nausea, vomiting once",
      "associated": "No vaginal discharge"
    },
    "past_medical_history": ["Recurrent lower UTIs"],
    "drug_history": ["Combined oral contraceptive"],
    "family_history": ["No relevant family history"],
    "social_history": ["Sexually active, one partner"],
    "review_of_systems": { "gynaecological": "Last period 1 week ago, not pregnant", "git": "No diarrhoea" }
  },
  "physical_exam": {
    "general": { "appearance": "Flushed, sweaty, looks unwell" },
    "vitals": {
      "blood_pressure": "104/64 mmHg",
      "heart_rate": "110 bpm",
      "respiratory_rate": "20/min",
      "temperature": "39.2 C",
      "spo2": "98% on room air"
    },
    "abdomen": { "palpation": "Right flank tenderness, no peritonism", "renal_angle": "Right renal angle tenderness" },
    "cardiovascular": { "heart_sounds": "Tachycardic", "capillary_refill": "2-3 seconds" }
  },
  "investigations": {
    "laboratory": [
      { "name": "Urinalysis", "normal_range": "Negative", "result": "Leucocytes +++, nitrites positive, blood +", "interpretation": "Strongly suggests UTI", "clinical_significance": "Supports urinary infection", "indicated": true },
      { "name": "Urine Culture", "result": "Sent; pending (likely E. coli)", "interpretation": "Pending", "clinical_significance": "Guides targeted antibiotics", "indicated": true },
      { "name": "Complete Blood Count", "normal_range": "WBC 4-11 x10^9/L", "result": "WBC 17.0 (neutrophilia)", "interpretation": "Leucocytosis", "clinical_significance": "Systemic infection", "indicated": true },
      { "name": "C-Reactive Protein", "normal_range": "< 5 mg/L", "result": "145 mg/L", "interpretation": "Raised", "clinical_significance": "Marker of infection", "indicated": true },
      { "name": "Blood Cultures", "result": "Sent before antibiotics", "interpretation": "Pending", "clinical_significance": "Detects bacteraemia in pyrexia/sepsis", "indicated": true },
      { "name": "Thyroid Function Tests", "result": "Within normal limits", "interpretation": "Normal", "clinical_significance": "Not contributory", "indicated": false, "low_yield_response": "Within normal limits / non-contributory" }
    ],
    "imaging": [
      { "name": "Renal Ultrasound", "result": "Normal kidneys, no obstruction or stone", "interpretation": "No obstruction", "clinical_significance": "Excludes obstructed/infected system needing drainage", "indicated": true }
    ],
    "bedside": [
      { "name": "Pregnancy Test", "result": "Negative", "interpretation": "Not pregnant", "clinical_significance": "Important in women of childbearing age before treatment", "indicated": true }
    ]
  },
  "diagnosis": {
    "final_diagnosis": "Acute pyelonephritis",
    "differentials": ["Lower urinary tract infection", "Renal/ureteric stone", "Pelvic inflammatory disease", "Appendicitis"],
    "explanation": "Fever with rigors, loin pain and renal angle tenderness plus pyuria/nitrites indicate ascending urinary infection of the kidney — acute pyelonephritis."
  },
  "management": {
    "emergency_management": [
      "Assess for sepsis (Sepsis Six if criteria met)",
      "Blood and urine cultures before antibiotics",
      "Empirical IV antibiotics per local policy",
      "IV fluids and antipyretics/analgesia"
    ],
    "definitive_management": ["De-escalate antibiotics to culture sensitivities", "Imaging if not improving to exclude obstruction/abscess"],
    "follow_up": ["Investigate recurrent UTIs", "Hydration and post-coital voiding advice"],
    "patient_education": ["Complete antibiotics", "Return if worsening or vomiting medications"]
  },
  "rubric": {
    "history": {
      "weight": 0.25,
      "items": [
        { "id": "hpi_urinary", "description": "Asked about urinary symptoms (dysuria, frequency)", "detection_cues": ["urine", "burning", "dysuria", "frequency", "urgency", "pee"], "weight": 1, "required": true, "red_flag": false },
        { "id": "hpi_loin_fever", "description": "Elicited loin pain and fever/rigors", "detection_cues": ["loin", "back pain", "flank", "fever", "rigor", "shiver"], "weight": 1, "required": true, "red_flag": false },
        { "id": "hpi_pregnancy", "description": "Asked about pregnancy possibility", "detection_cues": ["pregnan", "period", "lmp", "contracept"], "weight": 1, "required": false, "red_flag": false }
      ]
    },
    "physical_exam": {
      "weight": 0.15,
      "items": [
        { "id": "exam_vitals", "description": "Checked vitals (screen for sepsis)", "detection_cues": ["vitals", "temperature", "blood pressure", "pulse", "sepsis"], "weight": 1, "required": true, "red_flag": true },
        { "id": "exam_loin", "description": "Examined abdomen / renal angle", "detection_cues": ["abdomen", "loin", "flank", "renal angle", "palpate", "tender"], "weight": 1, "required": true, "red_flag": false }
      ]
    },
    "investigations": {
      "weight": 0.2,
      "expected": ["Urinalysis", "Urine Culture", "Blood Cultures", "Complete Blood Count", "C-Reactive Protein"],
      "not_indicated": ["Thyroid Function Tests"]
    },
    "diagnosis": {
      "weight": 0.2,
      "accepted": ["Acute pyelonephritis", "Pyelonephritis", "Upper UTI"],
      "acceptable_differentials": ["Lower urinary tract infection", "Renal/ureteric stone", "Pelvic inflammatory disease", "Appendicitis"]
    },
    "treatment": {
      "weight": 0.15,
      "items": [
        { "id": "tx_cultures_then_abx", "description": "Cultures then empirical IV antibiotics", "detection_cues": ["culture", "antibiotic", "iv antibiotic", "before antibiotics"], "weight": 2, "required": true, "red_flag": true },
        { "id": "tx_fluids", "description": "IV fluids / sepsis management", "detection_cues": ["fluid", "saline", "sepsis", "resuscitat"], "weight": 1, "required": true, "red_flag": false }
      ]
    },
    "communication": {
      "weight": 0.05,
      "items": [
        { "id": "comm_explained", "description": "Explained diagnosis and plan", "detection_cues": ["explain", "tell you", "going to"], "weight": 1, "required": false, "red_flag": false }
      ]
    }
  },
  "teaching_points": {
    "pearls": ["Renal angle tenderness + fever distinguishes pyelonephritis from a lower UTI.", "Always take cultures before antibiotics and exclude pregnancy."],
    "pitfalls": ["Missing an obstructed infected kidney (needs urgent drainage).", "Not screening for sepsis."],
    "references": ["NICE: Pyelonephritis (acute) antimicrobial prescribing"],
    "learning_objectives": ["Differentiate upper vs lower UTI.", "Manage with cultures, antibiotics and fluids.", "Recognise sepsis and obstruction."]
  }
}
