{
  "metadata": {
    "case_id": "pulmonary-tb-intermediate-pk",
    "title": "Chronic cough with weight loss and night sweats in a 35-year-old",
    "difficulty": "Intermediate",
    "specialty": "Internal Medicine",
    "estimated_time": 28,
    "author": "seed",
    "schema_version": 1,
    "reviewed_by": "Dr. A. Reviewer",
    "reviewer_credentials": "MBBS, FCPS (Medicine)",
    "reviewed_at": "2026-06-21",
    "medical_signoff": true
  },
  "patient": {
    "name": "Ghulam Rasool",
    "age": 35,
    "gender": "male",
    "occupation": "Daily-wage labourer",
    "ethnicity": "Pakistani",
    "personality": "Worn out, embarrassed about coughing",
    "communication_style": "Soft-spoken, coughs frequently during the interview"
  },
  "history": {
    "chief_complaint": "Cough for over a month with weight loss and fevers at night",
    "history_of_presenting_illness": {
      "onset": "Productive cough for 6 weeks, gradually worsening",
      "sputum": "Yellow sputum; streaks of blood twice (haemoptysis)",
      "systemic": "Loss of appetite, lost about 6 kg, drenching night sweats",
      "fever": "Low-grade evening fevers",
      "contact": "Lives in a crowded household; an uncle was treated for TB last year"
    },
    "past_medical_history": ["No known diabetes (but never tested)"],
    "drug_history": ["Took over-the-counter cough syrups without benefit"],
    "family_history": ["Uncle had pulmonary TB"],
    "social_history": ["Smokes 10/day", "Lives in a small, crowded home", "Low income"],
    "review_of_systems": { "cardiovascular": "No chest pain", "git": "No vomiting" }
  },
  "physical_exam": {
    "general": { "appearance": "Thin, cachectic, low body weight" },
    "vitals": {
      "blood_pressure": "118/76 mmHg",
      "heart_rate": "92 bpm",
      "respiratory_rate": "20/min",
      "temperature": "37.8 C",
      "spo2": "96% on room air"
    },
    "respiratory": { "auscultation": "Crackles over the right upper zone", "expansion": "Slightly reduced on the right apex" },
    "general_skin": { "lymph_nodes": "No palpable cervical lymphadenopathy" },
    "cardiovascular": { "heart_sounds": "Normal" }
  },
  "investigations": {
    "laboratory": [
      { "name": "Sputum GeneXpert (Xpert MTB/RIF)", "normal_range": "Not detected", "result": "MTB detected, rifampicin resistance not detected", "interpretation": "Confirms TB, rifampicin-sensitive", "clinical_significance": "Rapid confirmation and rifampicin-resistance screen", "indicated": true },
      { "name": "Sputum AFB Smear", "normal_range": "Negative", "result": "Acid-fast bacilli seen (2+)", "interpretation": "Smear-positive pulmonary TB", "clinical_significance": "Confirms infectiousness", "indicated": true },
      { "name": "Complete Blood Count", "normal_range": "Hb 13-17 g/dL", "result": "Mild anaemia, raised ESR", "interpretation": "Chronic-disease picture", "clinical_significance": "Supportive", "indicated": true },
      { "name": "HIV Test", "normal_range": "Non-reactive", "result": "Non-reactive", "interpretation": "Negative", "clinical_significance": "Routine in newly diagnosed TB", "indicated": true },
      { "name": "Thyroid Function Tests", "result": "Within normal limits", "interpretation": "Normal", "clinical_significance": "Not contributory", "indicated": false, "low_yield_response": "Within normal limits / non-contributory" }
    ],
    "imaging": [
      { "name": "Chest X-Ray", "result": "Right upper-lobe consolidation with cavitation", "interpretation": "Cavitary pulmonary TB", "clinical_significance": "Classic distribution; assesses extent", "indicated": true }
    ],
    "bedside": [
      { "name": "Random Blood Glucose", "result": "6.0 mmol/L", "interpretation": "Normal", "clinical_significance": "Screen for diabetes, which worsens TB outcomes", "indicated": true }
    ]
  },
  "diagnosis": {
    "final_diagnosis": "Pulmonary tuberculosis (rifampicin-sensitive)",
    "differentials": ["Community-acquired pneumonia", "Lung cancer", "Bronchiectasis", "Lung abscess"],
    "explanation": "Chronic productive cough with haemoptysis, weight loss and night sweats, a TB contact, upper-lobe cavitation on chest X-ray, and MTB detected on GeneXpert with AFB-positive sputum, confirm pulmonary tuberculosis."
  },
  "management": {
    "emergency_management": [
      "Place in respiratory isolation; advise cough hygiene",
      "Notify the TB programme; register for DOTS",
      "Start standard 4-drug anti-TB therapy (RIPE: rifampicin, isoniazid, pyrazinamide, ethambutol)",
      "Baseline LFTs and counselling on adherence"
    ],
    "definitive_management": ["2 months intensive then 4 months continuation phase", "Monitor sputum conversion and side effects"],
    "follow_up": ["Contact tracing and screening of household", "Treat any diabetes", "Nutritional support"],
    "patient_education": ["Adherence is essential to prevent resistance (MDR-TB)", "Cough hygiene", "Free treatment via the national programme"]
  },
  "rubric": {
    "history": {
      "weight": 0.25,
      "items": [
        { "id": "hpi_chronic_cough", "description": "Characterised chronic cough and haemoptysis", "detection_cues": ["cough", "how long", "weeks", "sputum", "blood", "haemoptysis"], "weight": 1, "required": true, "red_flag": false },
        { "id": "hpi_constitutional", "description": "Elicited weight loss / night sweats / fever", "detection_cues": ["weight", "night sweat", "appetite", "fever", "lost weight"], "weight": 2, "required": true, "red_flag": false },
        { "id": "hpi_contact", "description": "Asked about TB contact and living conditions", "detection_cues": ["contact", "tb", "tuberculosis", "family", "crowded", "household"], "weight": 1, "required": false, "red_flag": false }
      ]
    },
    "physical_exam": {
      "weight": 0.15,
      "items": [
        { "id": "exam_vitals", "description": "Checked vital signs", "detection_cues": ["vitals", "temperature", "respiratory rate", "saturation"], "weight": 1, "required": true, "red_flag": false },
        { "id": "exam_chest", "description": "Examined the respiratory system", "detection_cues": ["auscultat", "chest", "crackles", "breath sounds", "examine your chest"], "weight": 1, "required": true, "red_flag": false }
      ]
    },
    "investigations": {
      "weight": 0.2,
      "expected": ["Sputum GeneXpert (Xpert MTB/RIF)", "Chest X-Ray", "Sputum AFB Smear", "HIV Test"],
      "not_indicated": ["Thyroid Function Tests"]
    },
    "diagnosis": {
      "weight": 0.2,
      "accepted": ["Pulmonary tuberculosis", "Tuberculosis", "TB", "Pulmonary TB"],
      "acceptable_differentials": ["Community-acquired pneumonia", "Lung cancer", "Bronchiectasis", "Lung abscess"]
    },
    "treatment": {
      "weight": 0.15,
      "items": [
        { "id": "tx_att", "description": "Started standard 4-drug anti-TB therapy", "detection_cues": ["anti-tb", "ript", "ripe", "rifampicin", "isoniazid", "att", "dots", "four drug"], "weight": 2, "required": true, "red_flag": true },
        { "id": "tx_notify_isolate", "description": "Notification, isolation and contact tracing", "detection_cues": ["notify", "isolation", "contact tracing", "programme", "screen"], "weight": 1, "required": false, "red_flag": false }
      ]
    },
    "communication": {
      "weight": 0.05,
      "items": [
        { "id": "comm_explained", "description": "Explained diagnosis and the need for adherence", "detection_cues": ["explain", "adherence", "complete", "tell you", "course"], "weight": 1, "required": false, "red_flag": false }
      ]
    }
  },
  "teaching_points": {
    "pearls": ["GeneXpert gives rapid confirmation plus a rifampicin-resistance screen.", "Always test for HIV and diabetes in newly diagnosed TB."],
    "pitfalls": ["Treating recurrent 'pneumonia' without considering TB.", "Poor adherence driving MDR-TB — counsel and use DOTS."],
    "references": ["Pakistan National TB Control Programme; WHO TB guidelines"],
    "learning_objectives": ["Recognise pulmonary TB.", "Confirm with GeneXpert/smear and imaging.", "Start RIPE and arrange notification, isolation and contact tracing."]
  }
}
