{
  "metadata": {
    "case_id": "dengue-fever-basic-pk",
    "title": "High fever and severe body aches during monsoon season in Lahore",
    "difficulty": "Basic",
    "specialty": "Internal Medicine",
    "estimated_time": 25,
    "author": "seed",
    "schema_version": 1,
    "reviewed_by": "Dr. A. Reviewer",
    "reviewer_credentials": "MBBS, FCPS (Medicine)",
    "reviewed_at": "2026-06-21",
    "medical_signoff": true
  },
  "patient": {
    "name": "Ayesha Siddiqui",
    "age": 24,
    "gender": "female",
    "occupation": "School teacher",
    "ethnicity": "Pakistani",
    "personality": "Uncomfortable, aching all over",
    "communication_style": "Cooperative, winces with the body pain"
  },
  "history": {
    "chief_complaint": "Sudden high fever with terrible body and eye pain for 3 days",
    "history_of_presenting_illness": {
      "onset": "Abrupt, 3 days ago",
      "pain": "Severe muscle and joint aches; pain behind the eyes",
      "fever": "High and continuous",
      "rash": "A faint blanching rash appeared on the arms and chest today",
      "bleeding": "Mild gum bleeding when brushing teeth; no black stools",
      "context": "Several neighbours have dengue; standing rainwater near the house"
    },
    "past_medical_history": ["No chronic illness"],
    "drug_history": ["Took ibuprofen for the pain"],
    "family_history": ["No relevant family history"],
    "social_history": ["Lives in Lahore during monsoon season"],
    "review_of_systems": { "git": "Nausea, poor appetite", "respiratory": "No cough" }
  },
  "physical_exam": {
    "general": { "appearance": "Febrile, flushed face, looks unwell" },
    "vitals": {
      "blood_pressure": "108/70 mmHg",
      "heart_rate": "98 bpm",
      "respiratory_rate": "18/min",
      "temperature": "39.6 C",
      "spo2": "98% on room air"
    },
    "general_skin": { "rash": "Blanching macular rash on the trunk and limbs", "tourniquet_test": "Positive" },
    "abdomen": { "palpation": "Mild epigastric tenderness, no organomegaly" },
    "cardiovascular": { "heart_sounds": "Normal", "capillary_refill": "< 2 seconds (no shock currently)" }
  },
  "investigations": {
    "laboratory": [
      { "name": "Complete Blood Count", "normal_range": "Plt 150-400 x10^9/L", "result": "Plt 85 (falling), rising haematocrit, leucopenia", "interpretation": "Thrombocytopenia with haemoconcentration", "clinical_significance": "Key for dengue diagnosis and monitoring for plasma leakage", "indicated": true },
      { "name": "Dengue NS1 Antigen", "normal_range": "Negative", "result": "Positive", "interpretation": "Confirms acute dengue (early)", "clinical_significance": "Useful in the first few days of illness", "indicated": true },
      { "name": "Dengue Serology (IgM/IgG)", "normal_range": "Negative", "result": "IgM positive", "interpretation": "Supports acute dengue", "clinical_significance": "Positive from ~day 5", "indicated": true },
      { "name": "Liver Function Tests", "normal_range": "ALT < 40 U/L", "result": "Mildly raised transaminases", "interpretation": "Mild hepatitis", "clinical_significance": "Common in dengue; severity marker", "indicated": true },
      { "name": "Thyroid Function Tests", "result": "Within normal limits", "interpretation": "Normal", "clinical_significance": "Not contributory", "indicated": false, "low_yield_response": "Within normal limits / non-contributory" }
    ],
    "imaging": [
      { "name": "Chest X-Ray", "result": "No effusion currently", "interpretation": "Normal", "clinical_significance": "May show pleural effusion if plasma leakage develops", "indicated": false, "low_yield_response": "No acute abnormality / non-contributory" }
    ],
    "bedside": [
      { "name": "Malaria Rapid Diagnostic Test", "result": "Negative", "interpretation": "Negative", "clinical_significance": "Reasonable to exclude malaria as a co-endemic febrile illness", "indicated": true }
    ]
  },
  "diagnosis": {
    "final_diagnosis": "Dengue fever",
    "differentials": ["Malaria", "Enteric fever", "Chikungunya", "Viral hepatitis", "Leptospirosis"],
    "explanation": "Abrupt high fever with severe myalgia, retro-orbital pain, a blanching rash and positive tourniquet test during a monsoon outbreak, with thrombocytopenia, rising haematocrit and a positive NS1 antigen, confirms dengue fever."
  },
  "management": {
    "emergency_management": [
      "Assess for dengue warning signs and plasma-leakage/shock",
      "Careful oral or IV fluid management; monitor haematocrit and platelets",
      "Paracetamol for fever — AVOID NSAIDs and aspirin (bleeding risk)",
      "Serial CBC and observation"
    ],
    "definitive_management": ["Supportive care; escalate fluids per haematocrit if leakage develops", "Admit if warning signs"],
    "follow_up": ["Daily review during the critical phase (days 4-6)", "Vector control / remove standing water"],
    "patient_education": ["Stop NSAIDs", "Return immediately with abdominal pain, bleeding, or lethargy", "Mosquito-bite prevention"]
  },
  "rubric": {
    "history": {
      "weight": 0.25,
      "items": [
        { "id": "hpi_features", "description": "Elicited classic dengue features (retro-orbital pain, myalgia, rash)", "detection_cues": ["eye", "behind the eyes", "body ache", "muscle", "joint", "rash"], "weight": 1, "required": true, "red_flag": false },
        { "id": "hpi_warning_bleeding", "description": "Asked about bleeding / warning signs", "detection_cues": ["bleeding", "gum", "black stool", "abdominal pain", "vomit", "warning"], "weight": 2, "required": true, "red_flag": true },
        { "id": "hpi_context", "description": "Asked about outbreak/mosquito exposure", "detection_cues": ["mosquito", "outbreak", "neighbour", "monsoon", "standing water"], "weight": 1, "required": false, "red_flag": false }
      ]
    },
    "physical_exam": {
      "weight": 0.15,
      "items": [
        { "id": "exam_vitals", "description": "Checked vitals (assess for shock)", "detection_cues": ["vitals", "blood pressure", "pulse", "capillary refill", "shock"], "weight": 1, "required": true, "red_flag": true },
        { "id": "exam_skin", "description": "Examined skin / tourniquet test", "detection_cues": ["rash", "skin", "tourniquet", "bleeding", "examine"], "weight": 1, "required": true, "red_flag": false }
      ]
    },
    "investigations": {
      "weight": 0.2,
      "expected": ["Complete Blood Count", "Dengue NS1 Antigen", "Dengue Serology (IgM/IgG)", "Liver Function Tests"],
      "not_indicated": ["Thyroid Function Tests"]
    },
    "diagnosis": {
      "weight": 0.2,
      "accepted": ["Dengue fever", "Dengue", "Dengue viral fever"],
      "acceptable_differentials": ["Malaria", "Enteric fever", "Chikungunya", "Viral hepatitis", "Leptospirosis"]
    },
    "treatment": {
      "weight": 0.15,
      "items": [
        { "id": "tx_fluids_monitor", "description": "Fluid management and serial CBC monitoring", "detection_cues": ["fluid", "hydrat", "monitor", "haematocrit", "platelet", "cbc"], "weight": 2, "required": true, "red_flag": true },
        { "id": "tx_avoid_nsaids", "description": "Paracetamol and AVOID NSAIDs/aspirin", "detection_cues": ["paracetamol", "avoid nsaid", "no ibuprofen", "stop ibuprofen", "no aspirin"], "weight": 1, "required": true, "red_flag": false }
      ]
    },
    "communication": {
      "weight": 0.05,
      "items": [
        { "id": "comm_explained", "description": "Explained warning signs to return", "detection_cues": ["explain", "warning", "come back", "return", "tell you"], "weight": 1, "required": false, "red_flag": false }
      ]
    }
  },
  "teaching_points": {
    "pearls": ["NSAIDs and aspirin are contraindicated in dengue — use paracetamol.", "The critical (plasma-leakage) phase is around days 4-6 as the fever settles."],
    "pitfalls": ["Over- or under-hydration; not tracking serial haematocrit and platelets.", "Missing warning signs that herald severe dengue."],
    "references": ["WHO Dengue guidelines; Punjab dengue protocols"],
    "learning_objectives": ["Recognise dengue and its warning signs.", "Confirm with NS1/serology and CBC.", "Manage fluids and avoid NSAIDs."]
  }
}
